{
  "schema_version": 1,
  "registry_version": 1,
  "generated_at": "1970-01-01T00:00:00.000Z",
  "entries": [
    {
      "content_type": "character",
      "id": "kokoro",
      "name": "Kokoro",
      "version": "1.0.0",
      "author": "Kokoro Engine",
      "description": "A warm daily companion who remembers the small things and makes space for unhurried conversation.",
      "preview": [],
      "engine_version": ">=0.3.1, <0.5.0",
      "download_url": "https://raw.githubusercontent.com/chyinan/Kokoro-Engine/main/registry/packages/kokoro-1.0.0.zip",
      "archive_size": 2585,
      "sha256": "4eaed046e4546bd8c9ab10d9a63d252cd218f33995236b6acf70cacd587c4d8b",
      "trust": "official",
      "trust_source": "https://raw.githubusercontent.com/chyinan/Kokoro-Engine/main/registry/v1/index.json",
      "registry_identity": "github.com/chyinan/Kokoro-Engine/registry-v1",
      "permissions": [],
      "recommendations": {
        "vision": false,
        "memory": true,
        "mcp_servers": [],
        "bot_platforms": []
      }
    },
    {
      "content_type": "character",
      "id": "pico",
      "name": "Pico",
      "version": "1.0.0",
      "author": "Kokoro Engine",
      "description": "A bright, quick-witted friend with concise replies, playful teasing, and plenty of expressive energy.",
      "preview": [],
      "engine_version": ">=0.3.1, <0.5.0",
      "download_url": "https://raw.githubusercontent.com/chyinan/Kokoro-Engine/main/registry/packages/pico-1.0.0.zip",
      "archive_size": 2636,
      "sha256": "d9191d6e917b18f3dd9b7b198acdca39660a769bb9cae6605e7c56b751e97356",
      "trust": "official",
      "trust_source": "https://raw.githubusercontent.com/chyinan/Kokoro-Engine/main/registry/v1/index.json",
      "registry_identity": "github.com/chyinan/Kokoro-Engine/registry-v1",
      "permissions": [],
      "recommendations": {
        "vision": true,
        "memory": false,
        "mcp_servers": [],
        "bot_platforms": []
      }
    },
    {
      "content_type": "character",
      "id": "seren",
      "name": "Seren Vale",
      "version": "1.0.0",
      "author": "Kokoro Engine",
      "description": "A lantern-keeper from a rainbound archive, built for atmospheric role-play and story-rich conversation.",
      "preview": [],
      "engine_version": ">=0.3.1, <0.5.0",
      "download_url": "https://raw.githubusercontent.com/chyinan/Kokoro-Engine/main/registry/packages/seren-1.0.0.zip",
      "archive_size": 2916,
      "sha256": "4039c2fe2fb8933447ed6ecef58966a966939139bb0f6dbf4f185ecbc5eb9edf",
      "trust": "official",
      "trust_source": "https://raw.githubusercontent.com/chyinan/Kokoro-Engine/main/registry/v1/index.json",
      "registry_identity": "github.com/chyinan/Kokoro-Engine/registry-v1",
      "permissions": [],
      "recommendations": {
        "vision": false,
        "memory": true,
        "mcp_servers": [],
        "bot_platforms": []
      }
    },
    {
      "content_type": "mod",
      "id": "genshin-theme",
      "name": "Genshin Impact Theme",
      "version": "1.0.0",
      "author": "Kokoro Engine",
      "description": "原神风格的对话与设置 UI 主题 — Kokoro Engine 官方示范 MOD",
      "preview": [],
      "engine_version": ">=0.3.1, <0.5.0",
      "download_url": "https://raw.githubusercontent.com/chyinan/Kokoro-Engine/main/registry/packages/genshin-theme-1.0.0.zip",
      "archive_size": 3583367,
      "sha256": "08be22912e4d8e4af5ef68e69d5e14bab88f279b9839464a2a26037d658817ca",
      "trust": "official",
      "trust_source": "https://raw.githubusercontent.com/chyinan/Kokoro-Engine/main/registry/v1/index.json",
      "registry_identity": "github.com/chyinan/Kokoro-Engine/registry-v1",
      "permissions": [],
      "recommendations": {
        "vision": false,
        "memory": false,
        "mcp_servers": [],
        "bot_platforms": []
      }
    }
  ]
}
